Communications Log,Communications Log,Communications Log,Communications Log,Communications Log
"Record every outreach, email draft, partner call, funder note, and submission decision.","Record every outreach, email draft, partner call, funder note, and submission decision.","Record every outreach, email draft, partner call, funder note, and submission decision.","Record every outreach, email draft, partner call, funder note, and submission decision.","Record every outreach, email draft, partner call, funder note, and submission decision."
Date,Audience,Subject,Message / note,Status
2026-07-04,Internal,Drive file blocked,"Aureon Grant War Room is complete locally, but Google Drive create/upload is blocked until the app connection is reauthenticated with Drive file-create scope.",Action required
2026-07-04,Internal,Compliance alert,Companies House confirmation statement appears overdue. Clear this before funder submission where possible.,Action required
2026-07-04,Internal,Priority route,"Start with Invest NI advisor, Invest NI R&D, InterTradeIreland Innovation Boost, Next Wave go/no-go, EIC short proposal, and Eurostars partner search.",Planned
2026-07-04,Internal,Expanded funding scan,"Added NI small grants, DTFF, AKT 6, UKRI future AI calls, Horizon Cluster 4, Eureka network routes, and sector-adjacent robotics/energy/quantum watch items.",Logged
